{
   "general": {
      "title": {
         "en": "BioGenome Portal",
         "cat": "Portal BioGenome"
      },
      "description": {
         "en": "The Biogenome portal app provides a user friendly way to explore biodiversity genomics",
         "cat": "El portal Biogenome ofereix una manera amigable d'explorar la genòmica de la biodiversitat"
      },
      "cms": true,
      "goat": true,
      "map": true,
      "languages": [
         "en",
         "cat"
      ],
      "titleHighlight": {
         "en": "BioGenome",
         "cat": "BioGenome"
      }
   },
   "theme": {
      "colors": {
         "primary": "#22c55e",
         "secondary": "#3b82f6",
         "accent": "#2dd4bf"
      }
   },
   "cms": {
      "organisms": {
         "requiredSteps": [
            "goatStatus"
         ]
      }
   },
   "models": {
      "local_samples": {
         "label": {
            "en": "Local samples",
            "cat": "Mostres locals"
         },
         "description": {
            "en": "Locally registered samples",
            "cat": "Mostres registrades localment"
         },
         "filters": [],
         "columns": [
            "local_id"
         ],
         "charts": []
      }
   },
   "footer": {
      "copyright": {
         "en": "© BioGenome Portal",
         "cat": "© Portal BioGenome"
      },
      "tagline": {
         "en": "Exploring biodiversity through genomics",
         "cat": "Explorant la biodiversitat a través de la genòmica"
      }
   }
}
